快速发泡装置,【授权公告】,同族：1,引证：0,被引：0
快速发泡装置及快速发泡方法,【公开】,同族：1,引证：8,被引：0
机械式冰箱用制冷回路及机械式变频冰箱,【授权公告】,同族：1,引证：0,被引：0
机械式冰箱用制冷回路及机械式变频冰箱,【公开】,同族：1,引证：19,被引：0
搁物架及具有该搁物架的冰箱,【授权公告】,同族：1,引证：0,被引：0
电冰箱,【授权公告】,同族：1,引证：0,被引：0
一种冰箱横梁,【授权公告】,同族：1,引证：0,被引：0
对开门冰箱的包装方法及用于该包装方法的支撑垫,【公开】,同族：1,引证：11,被引：0
开关装置,【授权公告】,同族：1,引证：0,被引：0
抽屉滑道及安装有该抽屉滑道的冰箱,【公开】,同族：2,引证：10,被引：2
抽屉滑道及安装有该抽屉滑道的冰箱,【授权公告】,同族：2,引证：10,被引：2
具有钢丝搁物架的电冰箱,【授权公告】,同族：1,引证：0,被引：0
保鲜杀菌除臭结构,【授权公告】,同族：1,引证：0,被引：0
带有制冰机的冰箱,【公开】,同族：1,引证：12,被引：1
冰箱水路系统和具有该水路系统的冰箱,【公开】,同族：2,引证：12,被引：0
冰箱水路系统和具有该水路系统的冰箱,【授权公告】,同族：2,引证：12,被引：0
一种冰箱顶部结构及冰箱,【授权公告】,同族：1,引证：0,被引：0
防火主控板盒装置及冰箱,【授权公告】,同族：1,引证：0,被引：0
冰箱、冰箱门体以及显示装置,【公开】,同族：1,引证：8,被引：2
电冰箱出冰口密封装置,【授权公告】,同族：1,引证：0,被引：0
电冰箱,【公开】,同族：2,引证：12,被引：0
电冰箱,【授权公告】,同族：2,引证：12,被引：0
制冷装置,【授权公告】,同族：1,引证：0,被引：0
多门冰箱内胆的成型方法及成型机,【公开】,同族：1,引证：8,被引：3
冰箱及其锁紧装置,【公开】,同族：1,引证：14,被引：0
冰箱的冷凝器及具有该冷凝器的冰箱,【授权公告】,同族：1,引证：0,被引：0
用于冰箱的冷凝器、具有该冷凝器的冰箱及除露管,【授权公告】,同族：1,引证：0,被引：0
真空保鲜装置、冰箱及该真空保鲜装置的控制方法,【公开】,同族：1,引证：14,被引：0
冰箱,【公开】,同族：1,引证：24,被引：0
制冰装置及冰箱,【授权公告】,同族：1,引证：0,被引：0
门体制冰装置及冰箱,【公开】,同族：2,引证：10,被引：0
门体制冰装置及冰箱,【授权公告】,同族：2,引证：10,被引：0
上铰链装配结构及具有该上铰链装配结构的冰箱,【授权公告】,同族：1,引证：1,被引：1
利用多媒体技术的冰箱,【公开】,同族：1,引证：14,被引：1
利用无线射频识别技术的冰箱,【公开】,同族：2,引证：13,被引：3
利用无线射频识别技术的冰箱,【授权公告】,同族：1,引证：0,被引：0
利用多媒体技术的冰箱,【授权公告】,同族：1,引证：0,被引：0
利用无线射频识别技术的冰箱,【授权公告】,同族：2,引证：13,被引：3
冰箱把手及安装有该把手的冰箱,【授权公告】,同族：1,引证：0,被引：0
冰箱门体上铰链的连接结构及冰箱,【授权公告】,同族：1,引证：0,被引：0
冷藏装置及具有该冷藏装置的冰箱,【授权公告】,同族：1,引证：0,被引：0
一种冰箱,【公开】,同族：1,引证：8,被引：0
具有触摸显示功能的电冰箱门体及电冰箱,【授权公告】,同族：1,引证：0,被引：0
一种防凝露方法和系统,【公开】,同族：2,引证：12,被引：1
一种防凝露方法和系统,【授权公告】,同族：2,引证：12,被引：1
变温室及冰箱,【授权公告】,同族：1,引证：0,被引：0
变温室及冰箱,【授权公告】,同族：1,引证：0,被引：0
设有制冰系统的冰箱,【公开】,同族：2,引证：10,被引：0
一种冰箱搁物架及冰箱,【授权公告】,同族：1,引证：0,被引：0
冰箱门体铰链及安装有该铰链的冰箱,【授权公告】,同族：1,引证：0,被引：0
冰箱搁物架及冰箱,【授权公告】,同族：1,引证：0,被引：0
一种冰箱,【授权公告】,同族：1,引证：0,被引：0
设有制冰系统的冰箱,【授权公告】,同族：2,引证：10,被引：0
带有制冰系统的冰箱,【公开】,同族：1,引证：10,被引：0
一种用于电冰箱的出风调节装置及电冰箱,【公开】,同族：2,引证：12,被引：0
一种用于电冰箱的出风调节装置及电冰箱,【授权公告】,同族：2,引证：12,被引：0
开关装置及具有该开关装置的门、保温室及冰箱,【授权公告】,同族：1,引证：0,被引：0
具有隐形滑轨的冷冻抽屉,【授权公告】,同族：1,引证：1,被引：1
冰箱门体上铰链的连接结构及冰箱,【授权公告】,同族：1,引证：0,被引：0
用于电冰箱的制冰机的挡水装置,【公开】,同族：2,引证：12,被引：0
用于电冰箱的制冰机的挡水装置,【授权公告】,同族：2,引证：12,被引：0
冰箱搁物架及安装有该搁物架的冰箱,【授权公告】,同族：1,引证：0,被引：0
冰箱用可调下铰链及安装有该下铰链的冰箱,【公开】,同族：2,引证：6,被引：0
电冰箱,【公开】,同族：2,引证：7,被引：2
冰箱用可调下铰链及安装有该下铰链的冰箱,【授权公告】,同族：2,引证：6,被引：0
电冰箱,【授权公告】,同族：2,引证：7,被引：2
一种冰箱用保湿抽屉,【授权公告】,同族：1,引证：0,被引：0
